<?xml version="1.0" encoding="UTF-8" standalone="no" ?>
<?xml-stylesheet type="text/xsl" href="petshop.xsl"?>

<petShopServices xmlns:xsi="http://www.w3.org/2001/XMLSchema-instance"
	xsi:noNamespaceSchemaLocation="petshop.xsd"> 
    <service name="Grooming">
            <petName>Lulinha</petName>
            <animalType>Dog</animalType>
            <ownerName>Paulo</ownerName>
            <ownerPhone>0838884408</ownerPhone>
    </service>

    <service name="Vaccinate">
        <petName>Tirulipa</petName>
            <animalType>Dog</animalType>
            <ownerName>Johny</ownerName>
            <ownerPhone>0838847842</ownerPhone>
       
    </service>

    <service name="Castrate">
       
            <petName>Matuzal√©m</petName>
            <animalType>Dog</animalType>
            <ownerName>Fred</ownerName>
            <ownerPhone>0885859587</ownerPhone>
       
     </service>

    <service name="Blood Test + Chipping">
       
            <petName>Meleca</petName>
            <animalType>Cat</animalType>
            <ownerName>Lucia</ownerName>
            <ownerPhone>0838746592</ownerPhone>
      
    </service>

      <service name="Blood Test + Chipping">
       
            <petName>ABC</petName>
            <animalType>CDE</animalType>
            <ownerName>LMN</ownerName>
            <ownerPhone>0838746592</ownerPhone>
       
    </service>
</petShopServices>